{
  "schema": "l4/outcome@1",
  "run_id": "r-20261005T0851Z-0b3c",
  "harness_version": "0.1.0",
  "harness_commit": "641af1f457d4b3f4f2f9b5a2c990c9532e090fa7",
  "exit_code": 11,
  "units": [
    {
      "unit": "openspec:add-bulk-discount",
      "phase_before": "none",
      "phase_after": "awaiting_human",
      "tasks": {
        "done": 0,
        "total": 1
      },
      "open_questions": [
        "Q-001"
      ],
      "verdict": null,
      "profiles": {
        "implementer": "codex",
        "clarifier": "claude-code",
        "s1_judge": "laya"
      },
      "cost_usd": 0.118187,
      "iteration": 1,
      "pr_url": "https://gitlab.example.com/example-group/dummy-agentic/-/merge_requests/23",
      "retry_after": null,
      "continuation": "not_needed",
      "exit_reason": null
    }
  ]
}
