{
  "schema": "l4/outcome@1",
  "run_id": "r-20261006T1936Z-db1f",
  "harness_version": "0.1.0",
  "harness_commit": "28b8cc3bf402077bac16c654cd6087286060ebd9",
  "exit_code": 13,
  "units": [
    {
      "unit": "openspec:change-low-stock-rule",
      "phase_before": "implementing",
      "phase_after": "halted",
      "tasks": {
        "done": 0,
        "total": 1
      },
      "open_questions": [],
      "verdict": null,
      "profiles": {
        "implementer": "codex"
      },
      "cost_usd": 0.0,
      "iteration": 3,
      "pr_url": "https://gitlab.example.com/example-group/dummy-agentic/-/merge_requests/34",
      "retry_after": null,
      "continuation": "not_needed",
      "exit_reason": "halted: task 1.1: max_task_attempts (3) reached in red; last failure: no new test: existing tests were changed and now fail: tests.test_stock::test_a_quantity_at_the_threshold_is_not_low. A red test is a new test with a new name; a test that passed at the base must still pass"
    }
  ]
}
