{
  "schema": "l4/outcome@1",
  "run_id": "r-20261006T1940Z-be5d",
  "harness_version": "0.1.0",
  "harness_commit": "28b8cc3bf402077bac16c654cd6087286060ebd9",
  "exit_code": 0,
  "units": [
    {
      "unit": "openspec:change-low-stock-rule",
      "phase_before": "implementing",
      "phase_after": "in_review",
      "tasks": {
        "done": 1,
        "total": 1
      },
      "open_questions": [],
      "verdict": "PASS",
      "profiles": {
        "implementer": "codex",
        "s1_judge": "laya"
      },
      "cost_usd": 0.075357,
      "iteration": 6,
      "pr_url": "https://gitlab.example.com/example-group/dummy-agentic/-/merge_requests/34",
      "retry_after": null,
      "continuation": "not_needed",
      "exit_reason": null
    }
  ]
}
