{
  "schema": "l4/outcome@1",
  "run_id": "r-20261006T0037Z-4065",
  "harness_version": "0.1.0",
  "harness_commit": "7ccbc43519142845be292acc54b1dee3914718b5",
  "exit_code": 13,
  "units": [
    {
      "unit": "openspec:add-shipping-notice",
      "phase_before": "awaiting_human",
      "phase_after": "escalated",
      "tasks": {
        "done": 1,
        "total": 1
      },
      "open_questions": [],
      "verdict": "FAIL",
      "profiles": {
        "implementer": "codex",
        "s1_judge": "laya"
      },
      "cost_usd": 0.140166,
      "iteration": 4,
      "pr_url": "https://gitlab.example.com/example-group/dummy-agentic/-/merge_requests/29",
      "retry_after": null,
      "continuation": "not_needed",
      "exit_reason": "escalated: verification failed and no fix round is left (see verification.md)"
    }
  ]
}
