{
  "schema": "l4/outcome@1",
  "run_id": "r-20261008T1003Z-64eb",
  "harness_version": "0.1.0",
  "harness_commit": "9bcfb9c8ccf3bf0bafb7976b1fb2853285fce447",
  "exit_code": 12,
  "units": [
    {
      "unit": "kiro:add-small-order-surcharge",
      "phase_before": "waiting_capacity",
      "phase_after": "waiting_capacity",
      "tasks": {
        "done": 3,
        "total": 5
      },
      "open_questions": [],
      "verdict": null,
      "profiles": {
        "implementer": "kiro"
      },
      "cost_usd": 0.0,
      "iteration": 2,
      "pr_url": "https://gitlab.example.com/example-group/dummy-agentic/-/merge_requests/38",
      "retry_after": "2026-10-08T10:11:28Z",
      "continuation": "not_needed",
      "exit_reason": "waiting_capacity: role implementer is unavailable: profile kiro is cooling until 2026-10-08T10:11Z (retry after 2026-10-08T10:11Z)"
    }
  ]
}
