{
  "schema": "l4/outcome@1",
  "run_id": "r-20261004T1934Z-f30b",
  "harness_version": "0.1.0",
  "harness_commit": "d1e06319227ddbad4d89bd61d6781e33abadabad",
  "exit_code": 11,
  "units": [
    {
      "unit": "openspec:add-shipping-fee",
      "phase_before": "none",
      "phase_after": "fixing",
      "tasks": {
        "done": 1,
        "total": 1
      },
      "open_questions": [
        "add-shipping-fee-fix-1/Q-001"
      ],
      "verdict": "PASS",
      "profiles": {
        "implementer": "codex"
      },
      "cost_usd": 0.150788,
      "iteration": 1,
      "pr_url": "https://gitlab.example.com/example-group/dummy-agentic/-/merge_requests/14",
      "retry_after": null,
      "continuation": "not_needed"
    }
  ]
}
