{
  "schema": "l4/outcome@1",
  "run_id": "r-20261006T1943Z-0b38",
  "harness_version": "0.1.0",
  "harness_commit": "4c922c4db5f35ee08267d95317c51e98f2f27c46",
  "exit_code": 13,
  "units": [
    {
      "unit": "openspec:add-shelf-code",
      "phase_before": "none",
      "phase_after": "halted",
      "tasks": {
        "done": 0,
        "total": 1
      },
      "open_questions": [],
      "verdict": null,
      "profiles": {
        "implementer": "f-nemotron-lightning"
      },
      "cost_usd": 0.0,
      "iteration": 1,
      "pr_url": null,
      "retry_after": null,
      "continuation": "not_needed",
      "exit_reason": "halted: task 1.1: max_task_attempts (3) reached in red; last failure: the agent step ended with status error: result invalid: summary: required"
    }
  ]
}
