{
  "schema": "l4/outcome@1",
  "run_id": "r-20261005T0825Z-e1cb",
  "harness_version": "0.1.0",
  "harness_commit": "2a68effa037756fcf1bcd23d3630e4436e09260c",
  "exit_code": 11,
  "units": [
    {
      "unit": "openspec:add-cent-rounding",
      "phase_before": "none",
      "phase_after": "awaiting_human",
      "tasks": {
        "done": 0,
        "total": 1
      },
      "open_questions": [
        "Q-001"
      ],
      "verdict": null,
      "profiles": {
        "implementer": "codex",
        "clarifier": "claude-code",
        "s1_judge": "jev"
      },
      "cost_usd": 0.101476,
      "iteration": 1,
      "pr_url": "https://gitlab.example.com/example-group/dummy-agentic/-/merge_requests/22",
      "retry_after": null,
      "continuation": "not_needed",
      "exit_reason": null
    }
  ]
}
